{
  "relationship_id": "01ARZ3NDEKTSV4RRFFQ69G5RM1",
  "source_claim_id": "01ARZ3NDEKTSV4RRFFQ69G5CM3",
  "target_claim_id": "01ARZ3NDEKTSV4RRFFQ69G5CM1",
  "kind": "contradicts",
  "rationale": "replication_failed",
  "revision": 43,
  "challenge_id": "01ARZ3NDEKTSV4RRFFQ69G5CH1",
  "created_at": "2026-09-07T09:30:00Z"
}
